<?xml version="1.0" encoding="UTF-8"?>
<?xml-stylesheet type="text/xsl" href="jyxo-web.xsl"?>
<SHOP xmlns="urn:x-hujer:feed:jyxo" xmlns:xsi="http://www.w3.org/2001/XMLSchema-instance"
	xsi:schemaLocation="urn:x-hujer:feed:jyxo jyxo.xsd">
	<SHOPITEM>
		<PRODUCT>Podložka pod myš - kočka</PRODUCT>
		<DESCRIPTION>Ergonomická podložka pod myš, potisk s perskou kočkou.</DESCRIPTION>
		<URL>http://obchod.cz/podlozky-pod-mys/kocka</URL>
		<IMGURL>http://obchod.cz/obrazky/podlozky-pod-mys/kocka.jpg</IMGURL>
		<PRICE>420</PRICE>
		<PRICE_VAT>504</PRICE_VAT>
		<VAT>0.2</VAT>
		<MANUFACTURER>Genius</MANUFACTURER>
		<EAN>8594026341404</EAN>
		<DELIVERY_DATE>14</DELIVERY_DATE>
	</SHOPITEM>
	<SHOPITEM>
		<PRODUCT>Světélkující podložka pod myš</PRODUCT>
		<DESCRIPTION>Fosforeskující okraj, nevyžaduje baterie.</DESCRIPTION>
		<URL>http://obchod.cz/podlozky-pod-mys/fosfor</URL>
		<IMGURL>http://obchod.cz/obrazky/podlozky-pod-mys/fosfor.jpg</IMGURL>
		<PRICE>620</PRICE>
		<PRICE_VAT>744</PRICE_VAT>
		<ITEM_TYPE>bazaar</ITEM_TYPE>
	</SHOPITEM>
</SHOP>
